[
  {
    "case_id": "robust-eft-transaction-confirmation-reference",
    "pair_id": "eft-transaction-confirmation",
    "variant": "reference",
    "question": "고객이 결제내역 확인을 요청하면 어떤 법적 의무와 절차를 확인해야 하나요?",
    "category": "surface_form_robustness",
    "difficulty": "medium",
    "domain": "electronic_finance",
    "top_k": 5,
    "expected_law_id": "010199",
    "expected_article_nos": ["제7조"],
    "expected_answer_points": ["이용자의 전자금융거래 내용 확인 수단을 검토한다."],
    "expected_abstain": false
  },
  {
    "case_id": "robust-eft-transaction-confirmation-lay",
    "pair_id": "eft-transaction-confirmation",
    "variant": "lay",
    "question": "손님이 자기가 언제 얼마를 결제했는지 보여 달라는데 어디까지 제공해야 하나요?",
    "category": "surface_form_robustness",
    "difficulty": "hard",
    "domain": "electronic_finance",
    "top_k": 5,
    "expected_law_id": "010199",
    "expected_article_nos": ["제7조"],
    "expected_answer_points": ["이용자의 전자금융거래 내용 확인 수단을 검토한다."],
    "expected_abstain": false
  },
  {
    "case_id": "robust-eft-error-correction-reference",
    "pair_id": "eft-error-correction",
    "variant": "reference",
    "question": "고객이 결제 오류 정정을 요구한 경우 회사가 따라야 할 조사와 통지 절차는 무엇인가요?",
    "category": "surface_form_robustness",
    "difficulty": "medium",
    "domain": "electronic_finance",
    "top_k": 5,
    "expected_law_id": "010199",
    "expected_article_nos": ["제8조"],
    "expected_answer_points": ["오류 조사와 처리 결과 통지 절차를 검토한다."],
    "expected_abstain": false
  },
  {
    "case_id": "robust-eft-error-correction-lay",
    "pair_id": "eft-error-correction",
    "variant": "lay",
    "question": "승인 금액이 잘못 찍혔다고 바로잡아 달라는 연락이 왔습니다. 확인 뒤 결과도 알려줘야 하나요?",
    "category": "surface_form_robustness",
    "difficulty": "hard",
    "domain": "electronic_finance",
    "top_k": 5,
    "expected_law_id": "010199",
    "expected_article_nos": ["제8조"],
    "expected_answer_points": ["오류 조사와 처리 결과 통지 절차를 검토한다."],
    "expected_abstain": false
  },
  {
    "case_id": "robust-eft-terms-disclosure-reference",
    "pair_id": "eft-terms-disclosure",
    "variant": "reference",
    "question": "결제서비스 계약을 체결할 때 약관 설명과 사본 교부, 약관 변경 알림은 어떻게 해야 하나요?",
    "category": "surface_form_robustness",
    "difficulty": "medium",
    "domain": "electronic_finance",
    "top_k": 5,
    "expected_law_id": "010199",
    "expected_article_nos": ["제24조"],
    "expected_answer_points": ["약관 명시·교부·설명과 변경 통지 절차를 검토한다."],
    "expected_abstain": false
  },
  {
    "case_id": "robust-eft-terms-disclosure-lay",
    "pair_id": "eft-terms-disclosure",
    "variant": "lay",
    "question": "가입 화면에 이용조건 링크만 두면 충분한가요? 나중에 조건을 바꿀 때 고객에게 어떻게 알려야 하나요?",
    "category": "surface_form_robustness",
    "difficulty": "hard",
    "domain": "electronic_finance",
    "top_k": 5,
    "expected_law_id": "010199",
    "expected_article_nos": ["제24조"],
    "expected_answer_points": ["약관 명시·교부·설명과 변경 통지 절차를 검토한다."],
    "expected_abstain": false
  },
  {
    "case_id": "robust-eft-dispute-handling-reference",
    "pair_id": "eft-dispute-handling",
    "variant": "reference",
    "question": "부정결제 민원이 접수되면 회사의 분쟁처리 절차와 외부 분쟁조정은 어떤 조문으로 검토하나요?",
    "category": "surface_form_robustness",
    "difficulty": "medium",
    "domain": "electronic_finance",
    "top_k": 5,
    "expected_law_id": "010199",
    "expected_article_nos": ["제27조"],
    "expected_answer_points": ["이의제기 처리와 외부 분쟁조정 절차를 검토한다."],
    "expected_abstain": false
  },
  {
    "case_id": "robust-eft-dispute-handling-lay",
    "pair_id": "eft-dispute-handling",
    "variant": "lay",
    "question": "본인이 하지 않은 결제라며 항의가 들어왔는데 사내 접수 창구와 외부 조정 절차를 어떻게 마련해야 합니까?",
    "category": "surface_form_robustness",
    "difficulty": "hard",
    "domain": "electronic_finance",
    "top_k": 5,
    "expected_law_id": "010199",
    "expected_article_nos": ["제27조"],
    "expected_answer_points": ["이의제기 처리와 외부 분쟁조정 절차를 검토한다."],
    "expected_abstain": false
  },
  {
    "case_id": "robust-eft-accident-liability-reference",
    "pair_id": "eft-accident-liability",
    "variant": "reference",
    "question": "해킹이나 접근매체 위조로 부정결제 사고가 발생했을 때 회사의 손해배상책임은 어떤 조문으로 검토하나요?",
    "category": "surface_form_robustness",
    "difficulty": "medium",
    "domain": "electronic_finance",
    "top_k": 5,
    "expected_law_id": "010199",
    "expected_article_nos": ["제9조"],
    "expected_answer_points": ["전자금융사고의 책임 원칙과 예외를 검토한다."],
    "expected_abstain": false
  },
  {
    "case_id": "robust-eft-accident-liability-lay",
    "pair_id": "eft-accident-liability",
    "variant": "lay",
    "question": "누군가 인증수단을 복제해 돈이 빠져나갔습니다. 이런 사고의 손실을 사업자가 부담하는 기준은 무엇인가요?",
    "category": "surface_form_robustness",
    "difficulty": "hard",
    "domain": "electronic_finance",
    "top_k": 5,
    "expected_law_id": "010199",
    "expected_article_nos": ["제9조"],
    "expected_answer_points": ["전자금융사고의 책임 원칙과 예외를 검토한다."],
    "expected_abstain": false
  },
  {
    "case_id": "robust-eft-record-retention-reference",
    "pair_id": "eft-record-retention",
    "variant": "reference",
    "question": "결제사업자가 거래기록을 생성·보존하고 기간 경과 후 파기할 때 확인할 조문은 무엇인가요?",
    "category": "surface_form_robustness",
    "difficulty": "medium",
    "domain": "electronic_finance",
    "top_k": 5,
    "expected_law_id": "010199",
    "expected_article_nos": ["제22조"],
    "expected_answer_points": ["전자금융거래기록의 생성·보존·파기 기준을 검토한다."],
    "expected_abstain": false
  },
  {
    "case_id": "robust-eft-record-retention-lay",
    "pair_id": "eft-record-retention",
    "variant": "lay",
    "question": "결제가 끝난 뒤 승인 내역과 접속 흔적을 얼마나 보관하고 언제 지워야 합니까?",
    "category": "surface_form_robustness",
    "difficulty": "hard",
    "domain": "electronic_finance",
    "top_k": 5,
    "expected_law_id": "010199",
    "expected_article_nos": ["제22조"],
    "expected_answer_points": ["전자금융거래기록의 생성·보존·파기 기준을 검토한다."],
    "expected_abstain": false
  },
  {
    "case_id": "robust-pipa-processing-delegation-reference",
    "pair_id": "pipa-processing-delegation",
    "variant": "reference",
    "question": "고객정보 처리업무를 콜센터 외주업체에 맡기려면 계약과 관리·감독 측면에서 무엇을 확인해야 하나요?",
    "category": "surface_form_robustness",
    "difficulty": "medium",
    "domain": "digital_business",
    "top_k": 5,
    "expected_law_id": "011357",
    "expected_article_nos": ["제26조"],
    "expected_answer_points": ["처리위탁 문서와 수탁자 관리·감독 의무를 검토한다."],
    "expected_abstain": false
  },
  {
    "case_id": "robust-pipa-processing-delegation-lay",
    "pair_id": "pipa-processing-delegation",
    "variant": "lay",
    "question": "상담 업무를 다른 업체에 넘기면서 회원 이름과 연락처도 보게 하려 합니다. 계약서와 사후 관리는 어떻게 해야 하나요?",
    "category": "surface_form_robustness",
    "difficulty": "hard",
    "domain": "digital_business",
    "top_k": 5,
    "expected_law_id": "011357",
    "expected_article_nos": ["제26조"],
    "expected_answer_points": ["처리위탁 문서와 수탁자 관리·감독 의무를 검토한다."],
    "expected_abstain": false
  },
  {
    "case_id": "robust-pipa-breach-notice-reference",
    "pair_id": "pipa-breach-notice",
    "variant": "reference",
    "question": "서비스에서 고객 개인정보가 유출되면 정보주체 통지와 기관 신고는 어떤 조문으로 검토하나요?",
    "category": "surface_form_robustness",
    "difficulty": "medium",
    "domain": "digital_business",
    "top_k": 5,
    "expected_law_id": "011357",
    "expected_article_nos": ["제34조"],
    "expected_answer_points": ["개인정보 유출 통지·신고 의무를 검토한다."],
    "expected_abstain": false
  },
  {
    "case_id": "robust-pipa-breach-notice-lay",
    "pair_id": "pipa-breach-notice",
    "variant": "lay",
    "question": "회원 명단이 외부로 새어 나간 사실을 알았습니다. 당사자와 감독기관에는 무엇을 알려야 합니까?",
    "category": "surface_form_robustness",
    "difficulty": "hard",
    "domain": "digital_business",
    "top_k": 5,
    "expected_law_id": "011357",
    "expected_article_nos": ["제34조"],
    "expected_answer_points": ["개인정보 유출 통지·신고 의무를 검토한다."],
    "expected_abstain": false
  },
  {
    "case_id": "robust-ip-patent-novelty-reference",
    "pair_id": "ip-patent-novelty",
    "variant": "reference",
    "question": "신규 기술을 특허출원 전에 GitHub에 공개하면 신규성에 어떤 문제가 생길 수 있나요?",
    "category": "surface_form_robustness",
    "difficulty": "medium",
    "domain": "intellectual_property",
    "top_k": 5,
    "expected_law_id": "001455",
    "expected_article_nos": ["제29조", "제30조"],
    "expected_answer_points": ["신규성과 공지예외 요건을 함께 검토한다."],
    "expected_abstain": false
  },
  {
    "case_id": "robust-ip-patent-novelty-lay",
    "pair_id": "ip-patent-novelty",
    "variant": "lay",
    "question": "출원하기 전에 개발 내용을 공개 저장소에 올려 버렸습니다. 그래도 권리를 받을 방법이 있나요?",
    "category": "surface_form_robustness",
    "difficulty": "hard",
    "domain": "intellectual_property",
    "top_k": 5,
    "expected_law_id": "001455",
    "expected_article_nos": ["제29조", "제30조"],
    "expected_answer_points": ["신규성과 공지예외 요건을 함께 검토한다."],
    "expected_abstain": false
  },
  {
    "case_id": "robust-ip-disclosure-exception-reference",
    "pair_id": "ip-disclosure-exception",
    "variant": "reference",
    "question": "발명자가 직접 기술을 공개한 뒤 12개월 안에 특허출원하면 공지예외를 적용받을 수 있나요?",
    "category": "surface_form_robustness",
    "difficulty": "medium",
    "domain": "intellectual_property",
    "top_k": 5,
    "expected_law_id": "001455",
    "expected_article_nos": ["제30조"],
    "expected_answer_points": ["공개 주체·기간·주장 절차를 검토한다."],
    "expected_abstain": false
  },
  {
    "case_id": "robust-ip-disclosure-exception-lay",
    "pair_id": "ip-disclosure-exception",
    "variant": "lay",
    "question": "제가 만든 기술을 시연회에서 먼저 보여줬습니다. 1년이 지나기 전 신청하면 공개 때문에 생긴 불이익을 피할 수 있나요?",
    "category": "surface_form_robustness",
    "difficulty": "hard",
    "domain": "intellectual_property",
    "top_k": 5,
    "expected_law_id": "001455",
    "expected_article_nos": ["제30조"],
    "expected_answer_points": ["공개 주체·기간·주장 절차를 검토한다."],
    "expected_abstain": false
  },
  {
    "case_id": "robust-ip-employee-invention-reference",
    "pair_id": "ip-employee-invention",
    "variant": "reference",
    "question": "직원이 회사 업무 중 기술을 개발했다면 직무발명에 해당하는지 무엇을 기준으로 판단하나요?",
    "category": "surface_form_robustness",
    "difficulty": "medium",